{
  "schemaVersion": "1.0",
  "id": "script-check-module",
  "version": "1.0.0",
  "title": "A lesson module with script checks",
  "outcome": "The student can state one fact about the lesson.",
  "blocks": [
    {
      "type": "text",
      "id": "intro",
      "body": "Read this short text."
    }
  ],
  "tasks": [
    {
      "id": "task-1",
      "prompt": "State the fact in one sentence.",
      "hints": [
        {
          "level": "nudge",
          "text": "Look again at the first sentence of task 1."
        },
        {
          "level": "question",
          "text": "What result do you expect from task 1 before you run anything?"
        },
        {
          "level": "partial-example",
          "text": "Here is the first step of task 1. Finish the rest yourself."
        },
        {
          "level": "full-answer",
          "text": "Here is a complete answer to task 1."
        }
      ]
    }
  ],
  "checks": [
    {
      "id": "c",
      "kind": "automated",
      "description": "A version 1.0 script runner with no fields stays valid.",
      "runner": {
        "type": "script"
      }
    }
  ],
  "prerequisites": [],
  "license": {
    "id": "CC-BY-4.0"
  }
}
